[
  {
    "id": "resolve-001",
    "kind": "resolve",
    "spec_clause": "CLC-v1 §8.5",
    "clc_revision": "CLC-1.11",
    "conformance_class": "CLC-A",
    "decision": {"verdict": "deny", "reason": "capability_not_authorized", "unresolved": []},
    "resolutions": [{"constraint": "varwof/constraint-v1:network:cidr:[\"192.0.2.0/24\"]", "status": "satisfied"}],
    "expect": {"verdict": "deny", "reason": "capability_not_authorized", "unresolved": []},
    "derivation": "terminal verdict: a deny passes through unchanged and resolutions are ignored — a deny is never revived by a satisfied report (§8.5 rule 1)"
  },
  {
    "id": "resolve-002",
    "kind": "resolve",
    "spec_clause": "CLC-v1 §8.5",
    "clc_revision": "CLC-1.11",
    "conformance_class": "CLC-A",
    "decision": {"verdict": "allow", "reason": null, "unresolved": []},
    "resolutions": [],
    "expect": {"verdict": "allow", "reason": null, "unresolved": []},
    "derivation": "terminal verdict: a fully evaluated allow carries nothing to discharge, so it passes through (§8.5 rule 1)"
  },
  {
    "id": "resolve-003",
    "kind": "resolve",
    "spec_clause": "CLC-v1 §8.5",
    "clc_revision": "CLC-1.11",
    "conformance_class": "CLC-A",
    "decision": {"verdict": "deny", "reason": "max_rows:violated", "unresolved": []},
    "resolutions": [{"constraint": "varwof/constraint-v1:max_rows:10", "status": "satisfied"}],
    "now": "2026-09-21T22:30:00Z",
    "expect": {"verdict": "deny", "reason": "max_rows:violated", "unresolved": []},
    "derivation": "even with a clock and a satisfied report, a terminal deny is never revived (§8.5 rule 1)"
  },
  {
    "id": "resolve-004",
    "kind": "resolve",
    "spec_clause": "CLC-v1 §8.5",
    "clc_revision": "CLC-1.11",
    "conformance_class": "CLC-A",
    "decision": {"verdict": "allow_unresolved", "reason": null, "unresolved": ["varwof/constraint-v1:network:cidr:[\"192.0.2.0/24\"]"]},
    "resolutions": [{"constraint": "varwof/constraint-v1:network:cidr:[\"192.0.2.0/24\"]", "status": "satisfied"}],
    "expect": {"verdict": "allow", "reason": null, "unresolved": []},
    "derivation": "the single obligation is reported satisfied → all satisfied → allow (§8.5 rule 6)"
  },
  {
    "id": "resolve-005",
    "kind": "resolve",
    "spec_clause": "CLC-v1 §8.5",
    "clc_revision": "CLC-1.11",
    "conformance_class": "CLC-A",
    "decision": {"verdict": "allow_unresolved", "reason": null, "unresolved": ["varwof/constraint-v1:network:cidr:[\"192.0.2.0/24\"]", "varwof/constraint-v1:network:cidr:[\"2001:db8::/32\"]"]},
    "resolutions": [
      {"constraint": "varwof/constraint-v1:network:cidr:[\"192.0.2.0/24\"]", "status": "satisfied"},
      {"constraint": "varwof/constraint-v1:network:cidr:[\"2001:db8::/32\"]", "status": "satisfied"}
    ],
    "expect": {"verdict": "allow", "reason": null, "unresolved": []},
    "derivation": "same-(scheme,type) obligations form a conjunction (§8.4); satisfying both → allow"
  },
  {
    "id": "resolve-006",
    "kind": "resolve",
    "spec_clause": "CLC-v1 §8.5",
    "clc_revision": "CLC-1.11",
    "conformance_class": "CLC-A",
    "decision": {"verdict": "allow_unresolved", "reason": null, "unresolved": ["varwof/constraint-v1:network:cidr:[\"192.0.2.0/24\"]", "varwof/constraint-v1:network:cidr:[\"2001:db8::/32\"]"]},
    "resolutions": [{"constraint": "varwof/constraint-v1:network:cidr:[\"192.0.2.0/24\"]", "status": "satisfied"}],
    "expect": {"verdict": "allow_unresolved", "reason": null, "unresolved": ["varwof/constraint-v1:network:cidr:[\"2001:db8::/32\"]"]},
    "derivation": "partial evaluation: one satisfied, one absent (→ unknown) → allow_unresolved with the remainder (§8.5 rule 6)"
  },
  {
    "id": "resolve-007",
    "kind": "resolve",
    "spec_clause": "CLC-v1 §8.5",
    "clc_revision": "CLC-1.11",
    "conformance_class": "CLC-A",
    "decision": {"verdict": "allow_unresolved", "reason": null, "unresolved": ["varwof/constraint-v1:network:cidr:[\"192.0.2.0/24\"]", "varwof/constraint-v1:network:cidr:[\"2001:db8::/32\"]"]},
    "resolutions": [],
    "expect": {"verdict": "allow_unresolved", "reason": null, "unresolved": ["varwof/constraint-v1:network:cidr:[\"192.0.2.0/24\"]", "varwof/constraint-v1:network:cidr:[\"2001:db8::/32\"]"]},
    "derivation": "no resolutions → every obligation unknown → unchanged allow_unresolved, obligations neither invented nor dropped (§8.5 rule 3/6)"
  },
  {
    "id": "resolve-008",
    "kind": "resolve",
    "spec_clause": "CLC-v1 §8.5",
    "clc_revision": "CLC-1.11",
    "conformance_class": "CLC-A",
    "decision": {"verdict": "allow_unresolved", "reason": null, "unresolved": ["varwof/constraint-v1:network:cidr:[\"192.0.2.0/24\"]"]},
    "resolutions": [{"constraint": "varwof/constraint-v1:network:cidr:[\"192.0.2.0/24\"]", "status": "unknown"}],
    "expect": {"verdict": "allow_unresolved", "reason": null, "unresolved": ["varwof/constraint-v1:network:cidr:[\"192.0.2.0/24\"]"]},
    "derivation": "an explicit unknown is the same as absent — the obligation stays unresolved (§8.5 rule 6)"
  },
  {
    "id": "resolve-009",
    "kind": "resolve",
    "spec_clause": "CLC-v1 §8.5",
    "clc_revision": "CLC-1.11",
    "conformance_class": "CLC-A",
    "decision": {"verdict": "allow_unresolved", "reason": null, "unresolved": ["varwof/constraint-v1:network:cidr:[\"192.0.2.0/24\"]"]},
    "resolutions": [{"constraint": "varwof/constraint-v1:network:cidr:[\"192.0.2.0/24\"]", "status": "violated"}],
    "expect": {"verdict": "deny", "reason": "network:violated", "unresolved": []},
    "derivation": "any violated → deny, reason = the offending constraint's {type}:violated (§8.5 rule 6)"
  },
  {
    "id": "resolve-010",
    "kind": "resolve",
    "spec_clause": "CLC-v1 §8.5",
    "clc_revision": "CLC-1.11",
    "conformance_class": "CLC-A",
    "decision": {"verdict": "allow_unresolved", "reason": null, "unresolved": ["varwof/constraint-v1:network:cidr:[\"192.0.2.0/24\"]", "varwof/constraint-v1:network:cidr:[\"2001:db8::/32\"]"]},
    "resolutions": [
      {"constraint": "varwof/constraint-v1:network:cidr:[\"192.0.2.0/24\"]", "status": "violated"},
      {"constraint": "varwof/constraint-v1:network:cidr:[\"2001:db8::/32\"]", "status": "satisfied"}
    ],
    "expect": {"verdict": "deny", "reason": "network:violated", "unresolved": []},
    "derivation": "a violated obligation dominates a satisfied one — conjunction, so any violation denies (§8.4/§8.5)"
  },
  {
    "id": "resolve-011",
    "kind": "resolve",
    "spec_clause": "CLC-v1 §8.5",
    "clc_revision": "CLC-1.11",
    "conformance_class": "CLC-A",
    "decision": {"verdict": "allow_unresolved", "reason": null, "unresolved": ["varwof/constraint-v1:network:cidr:[\"192.0.2.0/24\"]", "varwof/constraint-v1:network:cidr:[\"2001:db8::/32\"]"]},
    "resolutions": [{"constraint": "varwof/constraint-v1:network:cidr:[\"192.0.2.0/24\"]", "status": "violated"}],
    "expect": {"verdict": "deny", "reason": "network:violated", "unresolved": []},
    "derivation": "violated dominates unknown too — the deny is decided before the remainder (§8.5 rule 6)"
  },
  {
    "id": "resolve-012",
    "kind": "resolve",
    "spec_clause": "CLC-v1 §8.5",
    "clc_revision": "CLC-1.11",
    "conformance_class": "CLC-A",
    "decision": {"verdict": "allow_unresolved", "reason": null, "unresolved": ["varwof/constraint-v1:network:cidr:[\"192.0.2.0/24\"]"]},
    "resolutions": [
      {"constraint": "varwof/constraint-v1:network:cidr:[\"192.0.2.0/24\"]", "status": "satisfied"},
      {"constraint": "varwof/constraint-v1:network:cidr:[\"192.0.2.0/24\"]", "status": "violated"}
    ],
    "expect": {"verdict": "deny", "reason": "network:violated", "unresolved": []},
    "derivation": "repeated entries for one constraint combine most-restrictive-first (violated ≻ satisfied ≻ unknown) (§8.5 rule 4)"
  },
  {
    "id": "resolve-013",
    "kind": "resolve",
    "spec_clause": "CLC-v1 §8.5",
    "clc_revision": "CLC-1.11",
    "conformance_class": "CLC-A",
    "decision": {"verdict": "allow_unresolved", "reason": null, "unresolved": ["varwof/constraint-v1:network:cidr:[\"192.0.2.0/24\"]"]},
    "resolutions": [{"constraint": "varwof/constraint-v1:network:cidr:[\"198.51.100.0/24\"]", "status": "satisfied"}],
    "expect": {"verdict": "allow_unresolved", "reason": null, "unresolved": ["varwof/constraint-v1:network:cidr:[\"192.0.2.0/24\"]"]},
    "derivation": "a resolution outside the decision's obligation set is ignored — it cannot widen the result (§8.5 rule 5)"
  },
  {
    "id": "resolve-014",
    "kind": "resolve",
    "spec_clause": "CLC-v1 §8.5",
    "clc_revision": "CLC-1.11",
    "conformance_class": "CLC-A",
    "decision": {"verdict": "allow_unresolved", "reason": null, "unresolved": ["varwof/constraint-v1:time:window:[{\"start\":\"00:00\",\"end\":\"06:00\"}]"]},
    "now": "2026-09-21T02:00:00Z",
    "resolutions": [],
    "expect": {"verdict": "allow", "reason": null, "unresolved": []},
    "derivation": "core clock: now (02:00 UTC) lies in the [00:00,06:00) segment → time:window satisfied without a consumer report (§8.5 rule 3)"
  },
  {
    "id": "resolve-015",
    "kind": "resolve",
    "spec_clause": "CLC-v1 §8.5",
    "clc_revision": "CLC-1.11",
    "conformance_class": "CLC-A",
    "decision": {"verdict": "allow_unresolved", "reason": null, "unresolved": ["varwof/constraint-v1:time:window:[{\"start\":\"22:00\",\"end\":\"00:00\"}]"]},
    "now": "2026-09-21T21:00:00Z",
    "resolutions": [],
    "expect": {"verdict": "deny", "reason": "time:violated", "unresolved": []},
    "derivation": "core clock: 21:00 is outside [22:00,24:00) → time:violated (§8.5 rule 3/6)"
  },
  {
    "id": "resolve-016",
    "kind": "resolve",
    "spec_clause": "CLC-v1 §8.5",
    "clc_revision": "CLC-1.11",
    "conformance_class": "CLC-A",
    "decision": {"verdict": "allow_unresolved", "reason": null, "unresolved": ["varwof/constraint-v1:time:window:[{\"start\":\"22:00\",\"end\":\"00:00\"}]"]},